post_id,timestamp,subreddit,title,content,score,num_comments,url
doqwow,2019-10-29 14:52:02,depression,"Our most-broken and least-understood rules is ""helpers may not invite private contact as a first resort"", so we've made a new wiki to explain it","We understand that most people who reply immediately to an OP with an invitation to talk privately  mean only to help, but this type of response usually leads to either disappointment or disaster.  it usually works out quite differently here than when you say ""PM me anytime"" in a casual social context.  

We have huge admiration and appreciation for the goodwill and good citizenship of so many of you who support others here and flag inappropriate content - even more so because we know that so many of you are struggling yourselves.  We're hard at work behind the scenes on more information and resources to make it easier to give and get quality help here - this is just a small start.  

Our new wiki page explains in detail why it's much better to respond in public comments, at least until you've gotten to know someone.  It will be maintained at /r/depression/wiki/private_contact, and the full text of the current version is below.

*****

###Summary###

**Anyone who, while acting as a helper, invites or accepts private contact (I.e. PMs, chat, or any kind of offsite communication) early in the conversion is showing either bad intentions or bad judgement.  Either way, it's unwise to trust them.** 


""PM me anytime"" seems like a kind and generous offer. And it might be perfectly well-meaning, but, unless and until a solid rapport has been established, it's just not a wise idea.  Here are some points to consider before you offer or accept an invitation to communicate privately.

* **By posting supportive replies publicly, you'll help more people than just the OP. If your responses are of good quality, you'll educate and inspire other helpers.** [The 1-9-90 rule](https://en.wikipedia.org/wiki/1%25_rule_(Internet_culture\)) applies here as much as it does anywhere else on the internet.  

* People who are struggling with serious mental-health issues often (justifiably) have a low tolerance for disappointment and a high-level of ever-changing emotional need. **Unless the helper is able to make a 100% commitment to be there for them in every way, for as long as necessary, offering a personal inbox as a resource is likely to do more harm than good.** This is why mental-health crisis-line responders usually don't give their names and callers aren't allowed to request specific responders.  It's much healthier and safer for the callers to develop a relationship with the agency as a whole.  Analogously, it's much safer and healthier for our OPs to develop a relationship with the community as a whole.  Even trained responders are generally not allowed to work high-intensity situations alone.  It's partly about availability, but it's mostly about wider perspective and preventing compassion fatigue. 

* **If a helper gets in over their head with someone whose mental-health issues (including suicidality, which is often comorbid with depression) escalate, in a PM conversation it's much harder for others, including the /r/depression and /r/SuicideWatch moderators to help**.  (Contrary to common assumptions, moderators can't see or police PMs.)  

* In our observation over many years, the people who say ""PM me"" the most are consistently the ones with the least understanding of mental-health issues and mental-health support. We all have gaps in our knowledge and in our ability to communicate effectively.  Community input mitigates these limitations. **There's no reason why someone who's truly here to help would want to hide their responses from community scrutiny**.  If helpers are concerned about their own privacy, keep in mind that self-disclosure, when used supportively, is more about the feelings than the details, and that we have no problem here with the use of alt/throwaway accounts, and have no restrictions on account age or karma.  

*  We all know the internet is used by some people to exploit or abuse others.  These people *do* want to hide their deceptive and manipulative responses from everyone except their victims. There are many of them who specifically target those who are vulnerable because of mental-health issues. **If a helper invites an OP to talk privately and gives them a good, supportive experience, they've primed that person to be more vulnerable to abusers.** This sort of cognitive priming tends to be particularly effective when someone's in a state of mental-health crisis, when people rely more on heuristics than critical reasoning.

* If OPs want to talk privately, posting on a wide-open anonymous forum like reddit might not be the best option. Although we don't recommend it, we do allow OPs to request private contact when asking for support. If you want to do this, please keep your expectations realistic, and to have a careful look at the history of anyone who offers to PM before opening up to them.",2366,177,https://www.reddit.com/r/depression/comments/doqwow/our_mostbroken_and_leastunderstood_rules_is/
1jqw4tf,2025-04-03 22:23:23,depression,If anyone calls me within the next 51 minutes I won’t do it.,"I sent texts. I called. I went for runs. I loved everyone the best I could. I know it’s never been enough, and I just can’t do it anymore. Every bit of this life is utter pain, relieved only by a few minutes of sleep, where I dream of having friends, where I dream of being in school, where I dream of having relationships that don’t destroy my soul. Those dreams only last a few minutes, once a week or two, often prefaced or followed by intense psychological nightmares. 

Edit: I was sitting in the parking lot in my car with enough pills to OD in my pocket. A lot of what yall said helped me out. I’m still worried and stressed and depressed, but I’m gonna go through another day. Ill make a plan on what to do if I get close to this again. I’ll research mental health and make my own healing path. I did it before, I can do it again.
I didn’t think strangers on Reddit would be my reason not to end it all, but I’m glad yall are who you are. ♥️",76,40,https://www.reddit.com/r/depression/comments/1jqw4tf/if_anyone_calls_me_within_the_next_51_minutes_i/
1jqyw5o,2025-04-04 00:29:14,depression,Has your depression gotten better over time?,"Feeling hopeless right now honestly, and was wondering if there’s any even part success stories with alleviated severity of day to day life, or total 180’s to joy again somehow. 

(Edit: thanks everyone for the comments, I feel bad and kinda selfish for saying this because I’d rather no one relate and everyone get better, but it’s kind of nice knowing and relating to people that have had a long lasting struggle and that I’m not the only one like that. I don’t know anyone in my life that’s for sure depressed for a long time, and have felt especially lonely and lost partly for that reason partly for others but its nice knowing it’s not only me tbh. And the stories of it getting better or a noticeable different even small ones are inspiring, thank you.)",34,42,https://www.reddit.com/r/depression/comments/1jqyw5o/has_your_depression_gotten_better_over_time/
1jr4222,2025-04-04 05:04:56,depression,I think I've lost interest in life,"I don't know how to really explain it but I'll try my best. 

I struggle with depression and self harm, my mom isn't helpful. My dad barley notices me when he comes by as a matter of fact he only really says 2 things to me. My friends aren't helpful as they think I'm faking it (and I assume they think I'm a lost cause).

 I don't know if I wish I was dead sometimes, I don't know if I wish I was alive sometimes... I guess I just want to feel appreciated? Or just something that will change my outlook on life and people. It sucks having to pretend to be mentally okay. I fake pretty much everything and I feel like I'm getting closer to snapping and just ending it. 

(I'm sorry if this sounds cringe) ",11,1,https://www.reddit.com/r/depression/comments/1jr4222/i_think_ive_lost_interest_in_life/
1jqy81k,2025-04-03 23:57:31,depression,Just relapsed on bed rotting,I had broken myself free of a 5 year bed rot and today after a company rejected me for employment a second time (I've had over 150 rejections since getting laid off in 2023) it just became to unbearable and I went back to the one place I consider literal hell. I'm also staying in a place that there isn't a lot of space and I sleep on a 3 inch mattress topper folded in half on the floor that I also share with my beagle mix dog. ,15,2,https://www.reddit.com/r/depression/comments/1jqy81k/just_relapsed_on_bed_rotting/
1jqizrs,2025-04-03 13:51:38,depression,I plan to kill my self once my parents die,"I 15 F have no plan in life I’m worthless, the only reason I keep going is because of my parents they’re the only reason I haven’t die yet. I’m stressing about my future and life I can’t handle it I’m scared. 

Sometimes I know it sounds bad I wished my parents would die so I could stop living I can’t do this ",97,45,https://www.reddit.com/r/depression/comments/1jqizrs/i_plan_to_kill_my_self_once_my_parents_die/
1jr1xtb,2025-04-04 03:05:21,depression,i’m 16 and i don’t know.,"first time ever posting on reddit. i’ll tell you a little bit about me. i’m a junior with good grades and i love dentistry. i’m a advice friend people come to me a lot for advice whether it be on dating or whatever it is. 

here’s where it sucks for me. I don’t feel like i’ve accomplished shit. everywhere it just feels condescending like people just look down at me.  I have deep and long relationships with friends but I still feel just an empty pit of loneliness. There’s been a couple of other events that i won’t get into but I’ve been through these depression episodes since 8th grade. this one has been going on for 7 months and it’s only been getting shittier. usually when i have these little depressive episodes they get better and better. i’ve asked for help before in 8th grade and 10th grade. 8th grade i got told i was a fucking liar basically and 10th grade therapy didn’t do shit for me. so I just sucked it up and kept it pushing solo. i’m trying to do that now but it’s not working and I don’t feel like reaching out for help because that is just being a burden and ungrateful to what i have. 

yes I do suffer from suicidal thoughts and have planned them out before. this has been going on since 8th grade as well. I just want to fucking die sometimes and now it’s becoming more of a daily thought.  whether that be through overdosing, jumping off a balcony, or having the most tragic shit happen to me. And logically it’s like i’m blessed too so there shouldn’t be shit to complain about as well. i don’t know how much longer i can think like this before i actually do something to myself.

i just want to feel accepted
that’s all
and i’m sorry",8,3,https://www.reddit.com/r/depression/comments/1jr1xtb/im_16_and_i_dont_know/
1jr4kpc,2025-04-04 05:37:48,depression,Depressed people are the containers for normal people's sadness.,"idk, roughly that idea, and a pathetic attempt on trying to put the blame on ""normal"" people, and the blame is just, justifyable in my opinion.",5,1,https://www.reddit.com/r/depression/comments/1jr4kpc/depressed_people_are_the_containers_for_normal/
1jqktxf,2025-04-03 15:04:51,depression,Is life actually worth of living?,"to be clear, for some people life is 100% worth of living. Even for depressed people, even though you are struggling, there is always hope. Life isn’t wonderful, but as long as you’re alive, it can become. 

But also, for some people like me, life is just pure suffering. I was born ugly, stupid and unlucky. I had my third suicide attempt last week, everyone is soo worried for me and scared to even leave me alone. I feel so bad for being such a burden to them, but I can’t keep living for them. I am so tired for living for other people and their feelings. My doctor is trying to make me go to a psych ward, but I just don’t want to. I am on so many medication that I don’t even feel anything anymore. The only time when I feel happy, or when I feel anything at all, is when I am on hard drugs. But still, I haven’t feel happy for so long that I’ve forgot what happiness feels like. I am finishing nursing school in a few months, I’ll probably go to medical school to be a doctor, maybe I have a future but at this point it means nothing to me. I am so deep in this dark place that I don’t know if I’ll ever get out. I don’t even feel like I don’t deserve to live anymore. At this point, I REFUSE to live. I refuse to live in this sick, twisted world where women are so dehumanised, abused and used on a daily basis. I refuse to live in the world where my classmates (future doctors) are making fun of patients with serious illnesses bc they have to do colonoscopy or some medical procedure where they have to be naked or something similar. I refuse to live as a lesbian in this homophobic country. I refuse to live as this person I deeply hate. I refuse to live if I am not perfect. If I don’t have a perfect body, face, grades, if I am not smart etc etc. I am constantly chasing for something to grasp for, for any kind of at least fake hope, but at this point, there’s nothing. For me, life is just suffering and totally unworthy of living. I don’t see the point of reaching for help, of trying to chase fake happiness with drugs that are slowly destroying me, of fighting, of anything anymore. Does anyone else feel this way?   ",56,22,https://www.reddit.com/r/depression/comments/1jqktxf/is_life_actually_worth_of_living/
1jq4pk8,2025-04-03 00:39:41,depression,Here's your reminder that nobody actually gives AF,"Nobody cares about what you're going through. Nobody cares about what you been through. They only care about what you can do for them and how you make them feel. You're going through a rough time? Well nobody wants to deal with that. Lost in life? Nobody cares just figure it out, your an adult. You have trauma deeper than even you understand? Oh well get over it already. Nobody cares. They are tired of hearing about it. Nobody cares that you're lonely. The more lonely you are, the more lonely they want you to be. Weirdo! You have anxiety? Struggle talking to people? Hahaha what a loser.  This is the human condition. This is how people feel. Nobody gives half a fuck about you in reality. The second you're more trouble than your worth you're dropped. That ""friend"" will back stab you the second it benefits them. That partner simply settled for you. They are tired of you're whining so they will have someone at their job make them feel better by cheating. Everyone and everything disgusts me. I can't wait to be off this piece of shit planet.",665,144,https://www.reddit.com/r/depression/comments/1jq4pk8/heres_your_reminder_that_nobody_actually_gives_af/
1jqhtp6,2025-04-03 13:01:07,depression,Finding out suicidal thoughts are not normal,"The other day I was on call with my psychiatrist, and I hadn’t been truthful with her during our first meeting so I came clean. I told her that I had attempted suicide in the past. When she asked me when the last time I had seriously considered suicide was, I (proudly) told her I hadn’t thought of it seriously in a week (not including passive thoughts about wanting to die/ not exist). 

The thing is prior to being on medication I thought about killing myself CONSTANTLY. So, I thought it wasn’t such a big deal that these thoughts were still coming but with less frequency. My psychiatrist was kinda surprised and said she’d need to get me a “safety plan” with my university (basically emergency resources in case I had a crisis) and said we’d discuss increasing my medication and also the “fatal” side effects. For now I’m still taking the minimum dose. 

I just wanted to share. I sorta always knew it wasn’t normal to feel constantly suicidal, but it’s so normal to me. ",60,7,https://www.reddit.com/r/depression/comments/1jqhtp6/finding_out_suicidal_thoughts_are_not_normal/
1jr3k9a,2025-04-04 04:35:41,depression,I absolutely hate my life right now,"March was a rough month. I was laid off from my job in preparation for tariffs. I finally had a job where I wasnt paycheck to paycheck and enjoyed what I did. A week later I had an accident leaving me with a broken jaw, 3 messed up teeth, and nerve damage. No insurance or income. 

I refuse to pull my teeth, they’re in the front. They can be saved with root canals and crowns. But I can’t eat and barely talk, which is mostly from my jaw.

I was offered a job. A 33,000 pay cut, but I get insurance right away. And I absolutely hate it. I’ve had another job offer, something I’d be happy with and the same pay, but wouldn’t have insurance for 3 months. And right now I desperately need insurance. So I took the dreaded job. 9 hours of my day I’m absolutely miserable. I can barely talk, but being in customer service I have to. I haven’t eaten in 2 weeks, just protein shakes and ensure. Doctor gave me vitamins that make me so sick every day. I’m constantly in pain all day. I started door dashing, so when I’m not working I’m dashing. Currently working about 16 hours a day, and truth be told I’m still so far off from being able to afford my medical care.

With insurance I still need to come up with 6000 for my jaw. My teeth, I can get done at dental school for right over $1300 plus crowns compared to $6700 through actual dentist. 

I’m defeated. There’s no light. I hate my job. I’m constantly in pain and sick to my stomach from all the meds I’m on. I’m not suicidal, but I’ve never wanted to be put out of my misery so badly before. 

There’s no family to fall on. Parents don’t support my life and cut me off years ago. I was denied care credit. I can’t commit to paying back a loan. Can’t sell my plasma, because I need that right now. I’m just over life",4,1,https://www.reddit.com/r/depression/comments/1jr3k9a/i_absolutely_hate_my_life_right_now/
1jqu7dz,2025-04-03 21:04:13,depression,Alcohol makes my life bearable,"Im 25 ive been drinking since i was 19 and depressed since 14.

I learned to live with depression.

I crossed the barrier of suicide and learned that i cant go through.

Its kinda easy to live not wanting to just going,day to day thinking dying would be better but its impossible on your own accord.

I think of dying everyday but its something like a distant wish now.

Im drinking almost daily and just wish to not wake up next day,but i do and i just pull through.

Drinking helps me think differently somethimes its more ,,depressive"" but sometimes im singing aloud and smiling to myself with gnashing of teeth.

Its scary how it became the normal day.

Ps: I hate how living is considered good and suicide is ,,ALWAYS A BAD OPTION"",like who the f\*\*k decided i should live?",10,4,https://www.reddit.com/r/depression/comments/1jqu7dz/alcohol_makes_my_life_bearable/
1jr46g3,2025-04-04 05:12:36,depression,I need someone to talk to from time to time.,"I met this Russian girl on this subreddit last year and we talked a lot for a while. Talking to her made me feel much less lonely and made me feel like I finally had a friend. She is very busy nowadays and doesn't seem to have much connection with me, so she has kind of distanced herself from me. 

I would like nothing more than to have a friend I can talk to everyday. I get along with women a lot better then men because of my childhood, but I am willing to take to anyone. I can be very kind, considerate and understand. 

I am 27M from Bangladesh. Grew up and living in the UAE. ",2,0,https://www.reddit.com/r/depression/comments/1jr46g3/i_need_someone_to_talk_to_from_time_to_time/
1jr42rx,2025-04-04 05:06:07,depression,I’m tired of being lonely,My name is June bug as I go by online. I’m 24 years old black male. And all my life I’ve felt like people have always looked at me as strange. I’m 6’0 have dreads I work out 7 times a week everyday weight lifting and 2 hrs of cardio. Why because I was made fun of by my peers for being fat and having very bad acne. This I’m return made me and a bitter person. Which made me not talk to people always have my headphones on and I never smile because of my past experiences I’ve became very intimidating to people . I was told at work I’m scary looking or mean looking. I can’t help it every school photo of me it looks like a mug shot. So that explains why people are scared of me. It’s a curse because I’m used to being like this everyday it became my regular face also I’m socially awkward and shy and introverted which is also a curse because when I did try to have friends I was made fun of or never token serious . People ask me why I don’t smile this is why . I’m also very insecure about being black . I find it to be inferior and a curse. Why because the stereotypes. I get so many bad looks from people in public it makes me hate who I am and believe if I was white I’d have a much better and happy life . ,2,1,https://www.reddit.com/r/depression/comments/1jr42rx/im_tired_of_being_lonely/
1jqnh4p,2025-04-03 16:47:20,depression,Life is a cruel joke,"I can’t kill my self because I don’t want to hurt anyone but I know I’ll never be happy, not for more than a second. It’s like life teases me with that short feeling then strips me only to laugh at my pain. I want to die, I’m not a good person and I hate myself more than I can express and I literally feel nothing other than sadness, depression and anger. So much rage just waiting to spill out at a moments notice. The cruel part is we feel like this but I guarantee the moment we find something to live for or start feeling like our old selves some stray bullet or a car will take our lives out of nowhere. 

 I fight for my life everytime I’m like this and I’m tired of people telling me to fight. I’ve been fighting for 7+ years and it’s only getting worse yet people want me to think of others. Can I really not be selfish this once and let myself rest and find peace. I don’t wanna fight anymore, I just want to rest for once.",19,0,https://www.reddit.com/r/depression/comments/1jqnh4p/life_is_a_cruel_joke/
