post_id,timestamp,subreddit,title,content,score,num_comments,url
1jqj8bt,2025-04-03 14:01:35,depression,Judgment of others,"Today I was in the elevator and a neighbor came in rushing to work, started talking about how hard she works and grabbed my arm and said: ""I wish I had the good life you have"". This left me so disconcerted that I didn't know how to react, I just said that my life wasn't good. I've been very sad all day because I'm not working due to not being able to work and try hard enough. I have refractory depression that consumes my life in every way, I have already taken several antidepressants and nothing has improved. I also have generalized anxiety and to top it off I have chronic migraines. I went to the emergency room several times last year and no one sees that. I would like to know how you deal with this situation, from other people's judgment, people think we are lazy and don't put in the effort. ",1,2,https://www.reddit.com/r/depression/comments/1jqj8bt/judgment_of_others/
1jpnubw,2025-04-02 12:54:01,depression,Is not having the energy to do literally anything a sign of depresion?,"I just don't feel like doing anything anymore. I can't do well in college, I'll probably fail for the second time.

I don't want to play videogames anymore either. I barely have any motivation to take care of myself and my room.

Is this a sign of depression? I'm not suicidal but I want to get better and feel trapped.


Everytime I try to talk to someone they think it's just laziness. But I don't enjoy this. ",86,42,https://www.reddit.com/r/depression/comments/1jpnubw/is_not_having_the_energy_to_do_literally_anything/
1jqdg7r,2025-04-03 08:55:22,depression,I suffer less mentally when I'm sleep-deprived— Why ?,"It’s 10 AM now. I’ve been awake since 6 PM yesterday. So that’s... 16 hours with no sleep.

What’s weird is—I feel kinda chill. My confidence feels like it went up 40%. I’m not feeling as worthless or dumb as I usually do during the day. Even the loneliness doesn’t hit as hard.

Nothing in my life changed. I’m still in the same situation. But now, with no sleep, I don’t feel like I’m suffocating. My brain feels messed up from the bad sleep schedule, sure—but mentally, I’m okay. Still no real motivation, but I feel peaceful. No rumination. It's also easier to get things done.

Why is that? What’s the link between sleep deprivation and this temporary “clarity” or peace?
Could this mean something about my mental state?",2,1,https://www.reddit.com/r/depression/comments/1jqdg7r/i_suffer_less_mentally_when_im_sleepdeprived_why/
1jqb6ad,2025-04-03 06:22:39,depression,I want to go to see a psychologist but,"I need to go see a psychologist about how to  handle a narcissist spouse, and because of him im mentally depressed and its draining me. But everytime i talk about him i get chills or my heart beats very fasts and i always end up crying to anyone listening to me about him.. Is it ok to cry in front of the psychologist, i feel like i wont be able to do it because im
Such a emotional wreck:(.. ",3,3,https://www.reddit.com/r/depression/comments/1jqb6ad/i_want_to_go_to_see_a_psychologist_but/
cz6nfd,2019-09-03 15:49:51,SuicideWatch,"New wiki on how to avoid accidentally encouraging suicide, and how to spot covert incitement","We've been seeing a worrying increase in pro-suicide content showing up here and, and also going unreported. This undermines our purpose here, so we wanted to highlight and clarify our guidelines about both direct and indirect incitement of suicide.  

We've created a wiki that covers these issues.  We hope this will be helpful to anyone who's wondering whether something's okay here and which responses to report.  It explains in detail why *any* validation of suicidal intent, even an ""innocent"" message like ""if you're 100% committed, I'll just wish you peace"" is likely to increase people's pain, and why it's important to report even subtle pro-suicide comments. The full text of the wiki's current version is below, and it is maintained at [/r/SuicideWatch/wiki/incitement](http://www.reddit.com/r/SuicideWatch/wiki/incitement). 

We deeply appreciate everyone who gives responsive, empathetic, non-judgemental support to our OPs, and we particularly thank everyone who's already been reporting incitement in all forms.  

Please report any post or comment that encourages suicide (or that breaks any of the other guidelines in the sidebar) to the moderators, either by clicking the ""report"" button or by [sending us a modmail](https://www.reddit.com/message/compose?to=%2Fr%2FSuicideWatch) with a link. We deal with all guideline violations that are reported to us as soon as we can, but we can't read everything so community reports are essential. If you get a PM that breaks the guidelines, please report it both [to the reddit sitewide admins](http://www.reddit.com/report) and to us in modmail. 

Thanks to all the great citizens of the community who help flag problem content and behaviour for us.  
    
    

******
***[/r/SuicideWatch/wiki/incitement](http://www.reddit.com/r/SuicideWatch/wiki/incitement)***  
*******

###Summary###

**It's important to respect and understand people's experiences and emotions. It's never necessary, helpful, or kind to support suicidal intent. There are some common misconceptions (discussed below) about suicidal people and how to help them that can cause well-meaning people to inadvertently incite suicide. There are also people online who incite suicide on purpose, often while pretending to be sympathetic and helpful.** 

###Validate Feelings and Experiences, Not Self-Destructive Intentions###

We're here to offer support, not judgement.  That means accepting, with the best understanding we can offer, whatever emotions people express.  Suicidal people are suffering, and we're here to try to ease that by providing support and caring.  The most reliable way we know to de-escalate someone at risk is to give them the experience of feeling understood. That means not judging whether they should be feeling the way they are, or telling them what to do or not do.  

But there's an important line to draw here.  There's a crucial difference between empathizing with feelings and responding non-judgmentally to suicidal thoughts, and in any way endorsing, encouraging, or validating suicidal intentions or hopeless beliefs. **It's both possible and important to convey understanding and compassion for someone's suicidal thoughts without putting your finger on the scale of their decision.**

Anything that condones suicide, even passively, *encourages* suicide. It isn't supportive and does not help. It also violates reddit's sitewide rules as well as our guidelines. Explicitly inciting suicide online is a criminal offense in most jurisdictions. 

Do not treat any OP's post as meaning that will definitely die by suicide and can't change their minds or be helped. Anyone who's able to read the comments here still has a chance to choose whether or not to try to keep living, even if they've also been experiencing intense thoughts of suicide, made a suicide plan, or started carrying it out.  

In [the most useful empirical model we have](https://en.wikipedia.org/wiki/Interpersonal_theory_of_suicide), the desire to die by suicide primarily comes from two interpersonal factors; alienation and a sense of being a burden or having nothing to offer. These factors usually lead to a profound feeling of being unwelcome in the world. 

**So, any acceptance or reinforcement of suicidal intent, even something ""innocent"" like ""I hope you find peace"", is actually a form of covert shunning that validates a person's sense that they're unwelcome in the world. It will usually add to their pain even if kindly meant and gently worded.**  

###How to Avoid Validating Suicidal Intent###

Keep the following in mind when offering support to anyone at risk for suicide.  

* **People who say they don't want help usually can feel better if they get support that doesn't invalidate their emotions.** Unfortunately, [many popular ""good"" responses are actually counterproductive](https://www.speakingofsuicide.com/2015/03/03/what-not-to-say/). In particular, many friends and family tend to rely exclusively on trying to convince the suicidal person that ""it's not so bad"", and this is usually experienced as ""I don't understand what you're going through and I'm not going to try"".  People who've had ""help"" that made them feel worse don't want any more of the same.  It doesn't mean that someone who actually knows how to be supportive can't give them any comfort.   

*  **Most people who are suicidal want to end their** ***pain,*** **not their lives.**  It's almost never true that death is the only way to end these people's suffering. Of course there are exceptional situations, and we certainly acknowledge that, for some people, the right help can be difficult to find. But preventing someone's suicide doesn't mean prolonging their suffering if we do it by giving them real comfort and understanding. 

* ***An unfixable problem doesn't mean that a good life will never be possible***.  We don't have to fix or change anything to help someone feel better. It's important to keep in mind that the correlation between our outer circumstances and our inner experience is weaker and less direct than commonly assumed.  For every kind of difficult life situation, you will find some people who lapse into suicidal despair, and others who cope amazingly well, and a whole spectrum in between. A key difference is how much inner resilience the person has at the time. This can depend on many personal and situational factors. But when there's not enough, interpersonal support can both compensate for its absence and help rebuild it.  We go into more depth on the ""it gets better"" issue in [this PSA Post](https://www.reddit.com/r/SuicideWatch/comments/25igd7/whats_wrong_with_it_gets_better_what_if_it_doesnt/) which is always linked from our sidebar (community info on mobile) guidelines. 

* **There are** ***always*** **more choices than brutally forcing someone to stay alive or passively letting them end their lives**.

To avoid accidentally breaking the anti-incitement rule, don't say or try to imply that acting on suicidal thoughts is a good idea, or that someone can't turn back or is already dead.  Do whatever you can to help them feel cared for and welcome, at least in this little corner of the world.  [Our talking tips](http://redd.it/igh87) offer more detailed guidance.

###Look Out for Deliberate Incitement.  It May Come in Disguise.###

Often comments that subtly encourage suicidal intent actually come from suicide fetishists and voyeurs ([unfortunately this is a real and disturbing phenomenon](https://en.wikipedia.org/wiki/William_Francis_Melchert-Dinkel)). People like this *are* out there and the anonymous nature of reddit makes us particularly attractive to them.  

They will typically try to scratch their psychological ""itch"" by saying things that push people closer to the edge.  They often do this by exploiting the myths that we debunked in the bullet points above.  Specifically you might see people doing the following:

* Encouraging the false belief that the only way suicidal people can end their pain is by dying.  **There are** ***always*** **more and better choices than ""brutally forcing someone to stay alive"" or helping (actively or passively) them to end their lives**.

* Creating an artificial and toxic sense of ""solidarity"" by linking their encouragement of suicide to empathy.  They will represent themselves as the only one who really understand the suicidal person, while either directly or indirectly encouraging their self-loathing emotions and self-destructive impulses.  **Since most people in suicidal crisis are in desperate need to empathy and understanding, this is a particularly dangerous form of manipulation.**  

Many suicide inciters are adept at putting a benevolent spin on their activities while actually luring people away from sources of real help.  A couple of key points to keep in mind: 

* **Skilled suicide intervention -- peer or professional -- is based on empathic responsiveness to the person's feelings that reduces their suffering in the moment.**  Contrary to pop-culture myths, it does **not** involve persuasion (""Don't do it!""), cheerleading (""You've got this!"") or meaningless false promises (""Trust me, it gets better!""), or invalidation (""Let me show you how things aren't as bad as you think!"").  Anyone who leads others to expect these kinds of toxic responses, or any other response that prolongs their pain, from expert help may be covertly pro-suicide. (Of course, people sometimes do have bad experience when seeking mental-health treatment, and it's fine to vent about those, but processing our own disappointment and frustration is entirely different from trying to destroy someone else's hope of getting help.)

* **Choices made by competent responders are always informed by the understanding that breaching someone's trust is traumatic and must be avoided if possible.**  Any kind of involuntary intervention is an **extremely unlikely** outcome when someone consults a clinician or calls a hotline. (Confidentiality is addressed in more detail in [our Hotlines FAQ post](http://redd.it/1c7ntr)). The goal is always to provide all help with the client's full knowledge and informed consent. We know that no individual or system is perfect.  Mistakes that lead to bad experiences do sometimes happen to vulnerable people, and we have enormous sympathy for them. But anyone who suggests that this is the norm might be trying to scare people away from the help they need.  

Please [let us know discreetly](https://www.reddit.com/message/compose?to=%2Fr%2FSuicideWatch) if you see anyone exhibiting these or similar behaviours. We don't recommend trying to engage with them directly.",1782,248,https://www.reddit.com/r/SuicideWatch/comments/cz6nfd/new_wiki_on_how_to_avoid_accidentally_encouraging/
1jr0fpq,2025-04-04 01:47:30,SuicideWatch,Suicidal over my ugliness.,"Back when I was younger I used to be even uglier and I got called so many names. Well, trauma from childhood stuck with me. I can barely look in mirrors anymore without feeling disgusted. I want plastic surgery to fix my biggest flaws but I know I'll still hate myself. I'm so ugly, my face is unfixable. I hate this. I hate the fact that I'll probably die alone cause I'm the last option. It's ruining my life and I'm not sure how long I can keep going. I want to rip my face off. It's caused me depression, social anxiety and so many other issues.

I posted in the plastic surgery sub and everyone tells me not to have any. It doesn't make sense. It's a plastic surgery sub. I hate when people lie to me. I just want acceptance, not pity. Yet everyone lies to me.

How can I love myself when everyone is fake to me and I can't even look at myself?",55,42,https://www.reddit.com/r/SuicideWatch/comments/1jr0fpq/suicidal_over_my_ugliness/
1jqmz5u,2025-04-03 16:28:09,SuicideWatch,My pets are the reason why I haven't committed suicide,"Hi. I'm tired, so tired... Every day I wish to not wake up. Every day I think of ways of get out of this world. Some days are less awful, others are like today. I know I'm the problem, my brain is the problem; I can't handle to live. Every day is a fight with my thoughts... But I can't leave my beautiful and innocent pets behind. Maybe my family or husband would take care of them, but not like I do, and I know that. I mostly fine with feeling lonely, but when I'm with my husband and actually feeling lonely, it's unbearable. I don't know what else I could do, just stay and stay in this emptiness until it's my time, I guess. 
Thanks for reading.",110,27,https://www.reddit.com/r/SuicideWatch/comments/1jqmz5u/my_pets_are_the_reason_why_i_havent_committed/
1jqj7t5,2025-04-03 14:01:03,SuicideWatch,Korea fucking sucks,"I cant even get anti depressants or any drug by myself because its fucking illegal 

Only a month apart from exam, I have no friends, kids make fun of me behind my back and give me disgusted looks, avoids me etc

I don’t kno w what I did fucking wrong I dont even talk to them

I feel so lonely and so depressed… I just want a friend… that stays with me, that doesnt treat me like shit. Everyone else has a match so why cant I. Even outcasts have their own friend zone. Everyone thinks Im weak because I cry alot. 

I want to overdose sleeping pills. I cant even get into my dream high school because I cant pay fucking attention because of ADHD, and my parents wont believe me or take me seriously.

Nobody likes me. Pretend they do. Just for pity. ",118,29,https://www.reddit.com/r/SuicideWatch/comments/1jqj7t5/korea_fucking_sucks/
1jr4z9e,2025-04-04 06:04:14,SuicideWatch,I want to end my life,"I cant handle the  voices in my head, the overthinking. Feel like i have let my family down. The only way i know how to provide for them is to kill myself and leave them with a substantial death benefir payout. I often sti at the beach thinking of swiminfmg out as far as i can and then let go.. i feel worthless.",4,10,https://www.reddit.com/r/SuicideWatch/comments/1jr4z9e/i_want_to_end_my_life/
1jr49v8,2025-04-04 05:18:31,SuicideWatch,"It’s my bday today, I wish to die","I can’t live this life anymore, I’m in deep trouble. I wish I wasn’t gay and lonely. I give up. ",3,0,https://www.reddit.com/r/SuicideWatch/comments/1jr49v8/its_my_bday_today_i_wish_to_die/
1jr41t7,2025-04-04 05:04:32,SuicideWatch,"Suicidal all day, every day.","My friend committed suicide back in March, and it only served to encourage me to take my own life which I really wanted to do. I am so fucking miserable on this worthless planet with a worthless existence and I’d would love nothing more than to see everything fucking explode. I ask for help and I get bottles of pills shoved down my throat, money-hungry assholes who can’t help me because my life is shit and my brain is fine. So they fucking lock me away like an animal until I pretend I’m better. Instead of encouraging me to take off that fucking mask they make me sew it onto my face! All of you expect me to do this. Fuck all of you and fuck this world and fuck everyone in it.",5,2,https://www.reddit.com/r/SuicideWatch/comments/1jr41t7/suicidal_all_day_every_day/
1jr1nu1,2025-04-04 02:50:42,SuicideWatch,I want to die,i want to die i want to die i want to die i want to die i want to die i want to die i want to die i want to die i want to die i want to die i want to die i want to die i want to die i want to die i want to die i want to die i want to die i want to die i want to die i want to die i want to die i want to die i want to die i want to die i want to die i want to die i want to die i want to die i want to die i want to die ,7,2,https://www.reddit.com/r/SuicideWatch/comments/1jr1nu1/i_want_to_die/
1jr2ist,2025-04-04 03:36:39,SuicideWatch,I Need Advice To Keep Going,"Written by a 14 year old, I prefer to keep my identity a secret as anyone from my school or who know me might stumble upon this and start to worry about me. This was originally suppose to be a journal of my life, but it turned into some personal stuff.

Currently, I'm in 8th grade. I'm pretty down right now since I got my measurements wrong on my piece of wood in Tech Ed class, so I have to now buy a new piece of wood to fix it or I'll fail the class. I don't really wanna ask my dad to go and buy me some wood just for a stupid class, but I have no choice. My health class is also pretty boring. We started a health project about creating a “healthy” restaurant. The food that we wanna add has to have food labels and details of why it's good, better, or best. My group partner doesn't really do shit for every class. No wonder he's failing almost every class, plus his simple grammar sucks. After school, I came back depressed and pissed. Later at night, I have suicidal thoughts or thoughts about going in the army so my life doesn't go to a waste. I also want to care for my family, I just am too shy to express that I really do care about them and the things they do. This night, I shed tears of confusion and sadness. I don't know what to do with my life. My hopes are to find my purpose in high school. The suicidal thoughts and thoughts of just life in general keep popping up in my head. Atleast forward testing is done, so I don't have to overthink too much. I do wake up tired and am half awake at school. My reaction time is becoming slower due to my sleepiness. I'm also unfit and ugly with acne. Life is just this harsh sometimes. That's why I play games to escape reality. It's matters of what's in the game, not what's behind the monitor. I can probably get some agreements with that claim. If you're still reading, Thank you. If I ever stop writing, it's either that I've committed suicide or I've lost the will to live.

It's been about 10 minutes. I've calmed myself by watching YouTube shorts. After that, I tried to sleep, but I couldn't. The thoughts keep me awake. “What would happen if I die? The people that know me, what will my death trigger in them? Do they really care?” These kinds of thoughts keep coming back everyday. When I think about trying to kill myself, I picture seeing my whole family sobbing. I just can't see myself doing it if that thought keeps reaching out. “What purpose do I serve?” I ask myself. 

Life has shown the darkest of days for me. Brighter ones I hope will show. But as I'm at the bottom of despair, the light won't shine on me.

I've attempted to sleep again. Tears keep pouring off my face. I don't know what to do. It's not like I lost someone I know or love. But it really feels like a heartbreak. Eyes dry as the California forests, but were soaked like a rock under a waterfall not too long ago. I still don't know why im even having suicidal thoughts over school.

Please help me stand up again.

",6,2,https://www.reddit.com/r/SuicideWatch/comments/1jr2ist/i_need_advice_to_keep_going/
1jr3koo,2025-04-04 04:36:20,SuicideWatch,Suicide,"I'm exhausted. I'm not self harming so people assume I'm okay I'm just to tired to do it. I'm not better I don't wanna think of suicide but I've been fighting it since nine. A doctor in the hospital told me becuase it was never serious it was just cry for helps, it kinda fucking offended me. He told me if people wanted to kill themselfs they simply would. To me it was very traumatic. My first attempt was at fourteen, pills. I've tried like cutting hanging I od in my bathroom like he just brushed it off like it's nothing. Sometimes I think I should just go further idk. It would destroy my bf I know he loves me.. idk.",4,2,https://www.reddit.com/r/SuicideWatch/comments/1jr3koo/suicide/
1jqq0on,2025-04-03 18:23:35,SuicideWatch,Thinking about it is so comforting to me,"Whenever I begin to dwell on the mistakes I have made or something else I obsess over, and I feel so much shame and anxiety, I always just remind myself that I’m going to commit soon. It helps me cope to know that I won’t have to live with myself much longer. ",22,6,https://www.reddit.com/r/SuicideWatch/comments/1jqq0on/thinking_about_it_is_so_comforting_to_me/
1jqsa0t,2025-04-03 19:50:00,SuicideWatch,Please kill me. Please.,"I cant live anymore. I have anxiety and depression and I tried everything but nothing helped. I am 23 year old gambler who lost everything and who is in so much debt that it is impossible to recover from it. I dug myself a hole, now please, I am begging you bury me there and let me sleep. I cant live and I cant kill myself. I cant breathe anymore, I dont want to. God, if you exist, just kill me already. You did not give me anything, at least give me a chance to kill myself. Please.",16,2,https://www.reddit.com/r/SuicideWatch/comments/1jqsa0t/please_kill_me_please/
1jqz7dj,2025-04-04 00:44:41,SuicideWatch,I’m calm,I feel calm but I do not want to be here. I don’t know what I’m looking for posting this. I just have no one to share anything with. I don’t want to be here anymore. It’s just nothing. I don’t even feel depressed. I just feel nothing. ,5,1,https://www.reddit.com/r/SuicideWatch/comments/1jqz7dj/im_calm/
