post_id,timestamp,subreddit,title,content,score,num_comments,url
1jqz40b,2025-04-04 00:39:49,mentalhealth,Overwhelmed by cosmic fear and anxiety,"I've been under intense stress for a long time and my mental health is getting worse.

When the stress peaks, I get overwhelming thoughts — like the Earth is spinning too fast and will suddenly stop, slamming me into a wall. It feels like my brain is being spammed with these thoughts every half a second. Sometimes the thought is that a meteor will hit Earth and everything will be gone.

It's really hard to control myself in that situation

What’s strange is that it’s always related to the universe somehow. Like tonight, I’m extremely disturbed by the fact that we even exist. I know the scientific explanations, but looking around my room drives me mad — I just can’t grasp how all of this is real. I took a bunch of Xanax just to be able to sleep.

Does anyone have advice on how to stop this? I’m not ashamed of it — I just can’t function properly and it’s messing with my life.",1,0,https://www.reddit.com/r/mentalhealth/comments/1jqz40b/overwhelmed_by_cosmic_fear_and_anxiety/
1jqz1bj,2025-04-04 00:36:07,mentalhealth,to all my suicidal fellow’s.,"am intoxicated but had a thought and it turned into writing, in the off chance it touches someone here it is.

‘if you seem to find yourself on this earth, please take a step back; inhale a breath of fresh air. explore, nature is there to remind us of not only what is but what can be. live life to experience those little moments of joy where it all feels right, they are real. life will get better, and you deserve it; cherish any little moment because for all we know, we are the lightness our friends may need, but never say. grow, learn, blossom into the beautiful thing that you are and; life will surround you full of people whom would be lost without your presence. who could hold a dear part of your life like, that “necklace you never took off” instead of a harrowing group of ones who never knew you at all.’",1,0,https://www.reddit.com/r/mentalhealth/comments/1jqz1bj/to_all_my_suicidal_fellows/
1jqz01f,2025-04-04 00:34:19,mentalhealth,I feel inferior and stupid—I need advice.,"I took an online IQ test (AGCT) and scored 104. Additionally, I also took the GET and scored over 106. I believe these IQ tests are very accurate, but I still feel inferior.

I suffer from debilitating anxiety, depression, ocd, and adhd. I namely struggle with poor working memory, concentration, processing speed, and performance on a daily basis.

I have never been on medication for adhd, although, I am now on medication for depression and anxiety. My memory is starting to improve ever so slightly.

My trainer at work most likely believes I’m special needs as my memory is abysmal, and I ask far too questions. I lack confidence in myself, hesitate far foo often, and generally second guess myself, too.

This whole obsession might stem from ocd, this might just be an “obsessive” or “intrusive thought”. I’m not on medication for OCD. 

I struggle socially, don’t get social cues, usually don’t pick up on sarcasm, and people can’t tell if I’m serious or joking. I have a hard time relating/connecting with others. I believe I’m very socially awkward and others pick up on this. 

When someone asks me a question, I freeze up. I have a hard time answering when I’m put on the spot. Usually at work or in social situations, I go into fight/flight. 

How can I overcome this? 



",1,1,https://www.reddit.com/r/mentalhealth/comments/1jqz01f/i_feel_inferior_and_stupidi_need_advice/
1jqyur3,2025-04-04 00:27:19,mentalhealth,22 years old diagnosed with GAD,"Hello community, I was the ugly weak kinda fat guy who always gets bullied at school and no girl wanted to talk to him from 13 years old to 16 years old starting 17 years I switched school and decided to forget about all this , yet I noticed IBS-C symptoms started very light, ignored it and copped with it as doctors gave me meds that doesn’t do anything. By the age of 19 symptoms started to grow and I tried smoking , at that time smoking helped me, kept increasing the amount of smoking until it no longer was helping me instead it was increasing my pain , I never knew what’s going on I went to bunch of doctors all said I’m fine.
Last December decided to quit smoking, pornography , and caffeine. Every time I go to the toilet I feel pain everywhere been dealing with this until I got an anxiety nervous shock suddenly at home that left me with ear buzzing and light sensitivity, can’t feel any muscle and they never pump anymore when I train , can’t feel hot from cold weather and headaches afterwards  , no one is explaining anything got my ear and my eyes checked everything is fine doctors says.

Feeling like i lost everything can’t even write properly, I’m on SNRI for 14 days now .

Never thought my physical pain are caused by anxiety and never thought I would have anxiety
Nobody around me noticed .
It is sad when you start too late.
My parents wants me to cope with the new situation and I can’t I really can’t it feels like a different me.
I wanted a happy life I was planning for alot after graduation.

I feel like I’m alone like I have always been, I need someone besides me to calm me down.",1,2,https://www.reddit.com/r/mentalhealth/comments/1jqyur3/22_years_old_diagnosed_with_gad/
1jqyp54,2025-04-04 00:19:51,mentalhealth,I went for a walk to think about my life.,"I am sitting on a stone in the forest, just watching the moon while crying. Thinking about my future, and what will become of me. I have only talked to somebody about my feelings once. So I don't have an official diagnosis. In my future i will never be able to earn money, and I'm scared about what I will do if i live on my own. I have seen in the past year that I can't take care of myself or my pets as i used to. I rarely talk to friends and family, due to anxiety. I feel so lost. Today my mom started talking about me moving out. But I just put half of the money i have in investments in the bank. And I lost some of the money.

I silently freaked out, and went out the door. So I walked to the forest and sat on a stone in the darkness. After a while of looking at the moon. I saw something white. it scared me, So I turned on the flashlight on my phone and saw a hare. But it got scared of the flashlight and ran deeper into the forest. Seeing that hare made me want to write my thoughts out. And now I'm here on Reddit, feelin a little better. And I'm going to go home too my mom.",1,0,https://www.reddit.com/r/mentalhealth/comments/1jqyp54/i_went_for_a_walk_to_think_about_my_life/
1jqynse,2025-04-04 00:18:04,mentalhealth,The loneliness of autism,"Looking back on my life it is amazing how many times I got in trouble (trouble is the wrong word, more like I stood out) for not playing a game.

I think I have always hated competition. I have never gotten anything out of it. I hate what competition does to people.

Life with autism often feels like everyone is playing a game and my desire to play the game is zero.

A part of me thinks that everyone hates the game. But people keep playing it because it is the only game in town.

But I think there is another game- art.

I have come to think of art as humans having fun without it coming at the expense of someone else.

I get that everyone else seems to enjoy playing the game. But I do not play the game to the best of my ability.

I feel lonely when reading sometimes.",0,0,https://www.reddit.com/r/mentalhealth/comments/1jqynse/the_loneliness_of_autism/
1jqym5r,2025-04-04 00:15:55,mentalhealth,What might i be experiencing?,"I’m a 16 year old girl in the UK, i have a depression diagnosis and have been struggling with my mental health for my whole life, the past 4 years i’ve hardly left my home and even though i am a very extroverted person i just can’t get myself to leave 

CAMHS is currently trying to decide if i need medication as talking & behavioural therapies haven’t been much help but they said they’d like to understand what’s going on with me a bit more first and consider the possibility of there being another diagnosis to be made 

i do agree this this is probably more than just depression but i’m really not sure what, i honestly don’t even know if it IS depression because i don’t have any sort of self deprecating thoughts when it comes to leaving the house, no sort of “everyone hates you” or anything. 
I feel more of a frustration and it’s consistently been my brain and my body battling to get me to leave my damn bedroom, i’ve described it as my brain and my body being separate before and honestly that description feels the most accurate, i WANT to leave,i want to see my friends, i want to go to school and i know i deserve my future, i just can’t seem to get myself to do anything with that desire? 
I do also struggle a lot with getting overwhelmed by simple tasks, as i am writing this im sobbing but i dont feel sad or distressed by acknowledging the situation im in, its just overwhelming for my body and thats so irritating because i know im capable of more than this.
I literally feel like im stuck in the body of a toddler that doesn’t know how to walk.

I haven’t got a clue if there is a diagnosis that this would all fall under, maybe it’s a big symptom of years of self isolation but then again it’s just a continuous cycle if that’s all it is. 

Does anyone know what this could possibly be or what it could be a symptom of?",1,0,https://www.reddit.com/r/mentalhealth/comments/1jqym5r/what_might_i_be_experiencing/
1jqsyld,2025-04-03 20:15:33,mentalhealth,Managing depression and workload,"Hello. I have a question. How does one balance work during periods of low mood? Any strategies, something you've tried? Any suggestions would be super welcome. 

I am in treatment for depression and currently I'm in between a change in my medication. I had some side effects so my doctors had me swtich meds. It's been a month. 

This change in meds has me feeling distracted, with brain fog, low energy and although I'm functional I am also still sad. My doctors say I have to give time to the new meds. But the thing is, I have work and I am finding myself struggling a lot to catch up with most things I have to do. I get overwhelmed and stuff gets delayed frequently. I can tell my workload isn't too big, in fact I'm not given more than others. But I just can't. Some days I barely get anything done and I worry people at work will soon notice. 

How does one manage working while struggling with depression. 

Thanks! ",2,0,https://www.reddit.com/r/mentalhealth/comments/1jqsyld/managing_depression_and_workload/
1jqxvqv,2025-04-03 23:41:26,mentalhealth,How to make friends as someone who struggles with social anxiety,"I never would’ve thought I’d be asking people how to make friends, but here I am. I know this may sound stupid but how does one make friends? I’ve had not-so-great experiences with friends that have caused me to distance myself from friends and family. This has caused a rift in my ability to communicate and approach people with the intent of becoming their friends.

Is there any advice that could help me branch out of my comfort zone to meet new people? 

Any help is appreciated. ",1,0,https://www.reddit.com/r/mentalhealth/comments/1jqxvqv/how_to_make_friends_as_someone_who_struggles_with/
1jqxohw,2025-04-03 23:31:56,mentalhealth,"I hate going through life, it is absolute bullshit.","27 M

Ever since my 2nd to last semester in college in 2022, I've been on a downward spiral.  My family sucks and don't get along, I can't get a job in software development  no matter how much I practice, and I lost a childhood friend who I haven't seen in 6 years.

In terms of my friend it is really fucked up.  I think of suicide nearly everyday. Last year was brutal as  I lost my doberman to heart disease and career issues.  I was 27 at the time so fuck it might as well join the 27 club.  I dabbled in partial hanging and slowly was  figuring out.  He last messaged me in late February, but my dog passed on Feb 2nd so I've never seen it.  Around early June I messaged back (we talked through xbox mainly) and brought up the idea of hanging out again.  No response.  I did it again, on Jul 1st.  Keep in mind my bday was july 11th. No response. Fast forward  sometime in August,  for shits and giggles I googled him and found his obituary page.  Turns out he passed away in a car accident May 18th, so I've been talking to a ghost.  In my mind it is so fucked up that I didn't kill myself because I wanted to see him, but he was gone by the time I messaged him, so I was holding out for nothing.

Once I found out I was crashing out, with some self harm (not going into detail)

I hate myself so much for not making time for him as he is the only childhood friend I had that I still talked to.  I was in college and had car trouble, and also was job hunting which is also pointless as i cant land anything.  I'm probably just gonna kms with a gun once my friends wedding is done (highschool friends).",1,0,https://www.reddit.com/r/mentalhealth/comments/1jqxohw/i_hate_going_through_life_it_is_absolute_bullshit/
1jqxl0h,2025-04-03 23:27:24,mentalhealth,Abandonment and Rejection Issue,"How do I fight the overwhelming sadness and feelings of abandonment that I get?

I get these feelings now over the smallest things, and it sometimes takes days to get over. I know what causes it, I have been let down, abandoned, or left by so many people throughout my life (sometimes to no fault of their own) that now even just a canceled date sends me into a dark place for a day or two.

This week has been some of the worst feelings I’ve had of this. 

On Monday I was supposed to go out on a date, drove halfway there (he lives an hour away), and he texted me to see if we could reschedule to Wednesday because he was sick. In his defense, he had snapped me earlier in the day to say he wasn’t feeling the greatest.

Tuesday I was supposed to go see a good friend of mine I haven’t been able to hang out with in a few months, but as I got home Monday (from the canceled date) he also called to cancel for Tuesday because of work. 

So Tuesday I was pretty down but at least I had the rescheduled date for Wednesday to look forward to right? Wrong… Wednesday comes and he was going to text me when he got off of work so we could meet. I hear nothing from him, by 7 I gave up hope for that night and just lost it. I didn’t eat, I just went to bed and cried. All I want to do is sleep because I’m sick of crying. I had to pull myself together today and put on a happy face for work. As soon as I got to my car in the parking garage after work I felt an immense numb feeling and sadness. I sat there for almost an hour because I physically couldn’t put my hands on the steering wheel.

As I type this out, I’m laying in bed, wanting to just sleep, but wanting to write this out to try and get it out of my head in a way. How can I make this stop? As much as I am willing to right now, I can’t go to therapy. I make too much to get it for free/reduced cost and I make too little to be able to afford it. I can’t go for a walk or go outside, it’s fucking cold and I am honestly afraid of seeing people having fun together, it’ll only make me angry/lonely. If I stay at home I’m lonely, but if I try and do something fun I’ll be canceled on or rejected, which is worse. So here I sit, bitching about it on Reddit, wishing these feelings would go away.",1,0,https://www.reddit.com/r/mentalhealth/comments/1jqxl0h/abandonment_and_rejection_issue/
1jqxkk6,2025-04-03 23:26:50,mentalhealth,My education is screwed,"Hi! I’m Jada 14f and my vent is below this. Please be nice or I will get upset and cry about it or clock tea 🍵.

I have been feeling like utter trash because of how on and off I am on and off I am on my schoolwork. All it does is eat at my mind and no matter what I do, I always feel like I’m going to fail. It’s gotten so bad to the point I’m just think gonna wait it out and get my GED, I really just don’t wanna think about it man it just hurts so bad and I just feel so useless about it. It’s like ever since I homeschooled nothing has gotten better, it has only gotten worse and it likely will just get worse over time. I’ve done some work but after I do it, I kind of just hate touching it because it stresses me out severely, and it makes me feel like I may be neurodivergent since it feels like the only way this is happening because this should’ve gotten better, not terribly worse over time. I do also have anxiety and depression and likely other things that just make my education worse. And I can’t just “push through it” because I just can’t do things I hate and despise, it will just cause me to have a breakdown or a panic attack later. I feel I need to apologize to all the people who were involved with my education and just punish myself. I just feel like a really big failure and is just the stupidest and biggest crybaby, since I am crying/breaking down about this whole mess I made. I have struggled with things before and I eventually gotten through them, even when they sucked and took a really big tole on me. But this is something I’m gonna have to live with, because now my education is practically fucked and it will likely hold me back forever. I can just imagine my future now and it just looks so dull and terrible, and I’m just like really scared about it. What if I just tell my “hey this child that you love and thought was going to have an education is actually really dumb and can’t do shit”? What will happen when I have to admit this stuff? Will I be judged for it, will they understand me, will just hate me, will they feel the same, like what will they do? I’m scared. I just feel like a toddler who wants someone’s attention but I can never get it, and I just want it to stop it and get over it already. If I could get a little advice they would be nice. Thanks for reading my education rant.
Peace!

-from me",1,5,https://www.reddit.com/r/mentalhealth/comments/1jqxkk6/my_education_is_screwed/
1jqrb0s,2025-04-03 19:12:30,mentalhealth,I'm extremely sad and anxious and i don't know why that is,"Hello all, i'll be brief with it. I don't understand why but i find myself overwhelmed by sadness and anxiety as well as an awful sense of dread, even though literally nothing has happened to warrant this. I lay in my bed and i randomly burst out crying, or be so anxious i start shaking all over.

I don't know what's wrong with me, i just want to feel better but i can't because i don't even know why i feel this way.

If something was wrong then i could at least try to fix it, but nothing is wrong.

I just feel sad all the time for no apparent reason, i'm anxious even when i have nothing to do or to worry about. What can i do?",2,1,https://www.reddit.com/r/mentalhealth/comments/1jqrb0s/im_extremely_sad_and_anxious_and_i_dont_know_why/
1jqwq0u,2025-04-03 22:49:19,mentalhealth,Any advice?,"Hello. Im a 21 yo girl and I've never been an anxious type. I've been depressed pretty much all my life but never anxious 
Until a year ago I got a job that treated me horribly and my own place. Turns out I don't like living alone and that job really wasn't doing me a favor. The environment was toxic and I felt horrible there. One day I ate a melon for dinner and then it happened. My first ever real, bad, panic attack. I had it for 6 hours to the point of thinking of going to the ER . The next morning I was googling what happened and saw it could've been an allergic reaction. Boom. It all went down. I started having severe fear of any food in fear od developing any allergies and I had a panic attack every time after eating and lost 20kg. In september it started getting better and I completely stopped having panic attacks! I had moved out and quit the job. I also have anxiety about my health. Now, it's starting to creep back in. Sometimes I avoid foods out of fear and I constantly feel like my heart will stop. I just wanna feel okay. Any advice on  how to get better?
Edit: I get panic attacks for no reason or over food or over a strange sensation in my chest or throat, probably caused by my anxiety",1,3,https://www.reddit.com/r/mentalhealth/comments/1jqwq0u/any_advice/
1jqwpzj,2025-04-03 22:49:16,mentalhealth,I need help with what I might have.,"So for a bit of time now I will get episodes where I feel emotionless, but then that emotionless feeling will turn to straight anger out of nowhere, and if I can’t get that anger out at that exact moment it makes me want to just break down and have a severe depressive episode which usually ends in severe suicidal thoughts. 
It’s gotten worse recently and my family has started noticing it, which usually only makes it worse because all my family does is complain to me about any flaw(how I dress, speak, act, how I express emotion). I might have . I want to speak to a therapist but I live in a low income area and don’t have much money, and insurance won’t cover therapy sessions either. 

Please help me, I’m struggling being a good functioning person. I’m worried if this will continue to worsen as well.  

Edit 1: I forgot to add this part, whenever I talk to my friends about it they will sometimes bring up suppressed emotions. Could this be a cause?",1,3,https://www.reddit.com/r/mentalhealth/comments/1jqwpzj/i_need_help_with_what_i_might_have/
1jqwpa5,2025-04-03 22:48:21,mentalhealth,what do i tell my friends and professors?,"these past three weeks have been the worst weeks of my life. i’ve had really intense suicidal thoughts  and almost attempted. i’ve had no motivation to do anything and have cried everyday, prompting me to miss my classes for the last three weeks.

i seriously thought i was going to end it all. i stopped responding to my university advisor concerned about my attendance and my friends. my university reached out a few days ago saying they were going to kick me out if i continued to fail engage with my course. i had a zoom meeting yesterday with two well being officers and one guy said “you need to attend your two classes on friday or else we have no choice.” 

this is really bad but i had a group project in one of my classes and haven’t responded to the group chat in three weeks. i believe we had a report due this week, and obviously i didn’t contribute (though i did with a presentation we did earlier this semester). two of my closest friends have texted me and asked where i was. i was too ashamed to respond to them as well. i also need to email my teachers  explaining my absence.  

i know with my teachers i need to be honest. but with my friends, would it be fair to say i was at the hospital and didn’t have access to my phone? also not sure what to say to the people i had a group project with? i have anxiety and im dreading tomorrow so i have no idea what im going to do. please help!

for context i also have my first psychiatry appointment on tuesday!",1,0,https://www.reddit.com/r/mentalhealth/comments/1jqwpa5/what_do_i_tell_my_friends_and_professors/
1jqwkk8,2025-04-03 22:42:38,mentalhealth,I can't stop being depressed about not owning a home when my younger brother now owns 2 properties.,"I'm the only male in my family to not own a home or property and I hate it. I have no privacy and no space. People say it's nice to not own a home cause you don't have the maintenance.  Well , I actually love to fix things and make stuff new again. I have been in construction my whole life and doing repairs isn't scary to me. I've just been dealt a bad hand in life and my brain doesn't work like the others in my family. I'm the ""lazy one"". Labeled by my family. Instead , I pay the monetary equivalent of a mortgage to my landlord and wonder what I could do with my life if I owned instead of renting. Oh well, have a good day. I'll go back to being depressed ",1,0,https://www.reddit.com/r/mentalhealth/comments/1jqwkk8/i_cant_stop_being_depressed_about_not_owning_a/
1jqw0cl,2025-04-03 22:18:00,mentalhealth,I'm not fitting anywhere,"I always be excluded in my childhood and now I fell like I don't belong anywhere. I don't fit with anyone and can't be more that ""the guy is nice to talk only sometimes"" not a friend. Then I'm with others I always have the feelings to bother them. I not close to anyone and every time I talk to them I fell like there is a wall between us and they pity me. I think there is something deeply wrong with me and i deserve this. I sure i doing nothing wrong and i even make people laugh.

 I have stating to avoid everyone to not be a burden but is gonna sound hilarious I fell lonely now but I don't annoy nobody now ",1,4,https://www.reddit.com/r/mentalhealth/comments/1jqw0cl/im_not_fitting_anywhere/
