post_id,timestamp,subreddit,title,content,score,num_comments,url
1joo7rt,2025-04-01 05:31:21,addiction,A Letter to My Drug Addicted Mother,"Hello everyone. I hope all is well. My names Josie Kelley. I wrote my mom a letter after I had blocked her, and sent it by mail. She never ended up reading it. I want someone to see my heart. I know people in this community struggle with addiction. I know they struggle with many things. My heart goes out to all of you. Even if no one reads this, I want to put my heart on a platter from the daughters perspective of addiction. What I wrote below, it's what I desperately wished my mom knew when she thought I hated her.

Mama,

I know it’s weird to send a letter like this when we live in a day and age where phones and cars exist. I know I’ve made it hard for you to get in contact with me in those ways, but I needed to get my feelings out. Lately, and probably a lot of my life, it’s been hard for us to communicate with each other. Maybe it’s because we’re the only girls, or that we’re so alike, or maybe it’s just simply how life goes for two people who feel things so deeply. I hope you’ll read my full letter and its entirety. I had to type it out because I have a lot in my heart that I wish I could tell you. I have a lot of things that I want to get off of my chest. Please take the time to read it. I want to start off by telling you how much I love you, mama. I love you so much that sometimes I stay up at night and cry thinking that one day I’ll never see you again. I’ll cry thinking about how I haven’t seen you and that I miss you. I miss you so much. I don’t think I could put into words how I feel about you, mama. Out of every person on this Earth, I love you the most. I feel so complete when I’m with you. To me, you’re my safe place, you’re my home. You make me so happy, like a warm childish feeling. I could go without everything in the world if that meant I could be with you. I know I could handle losing some people, but I can’t handle losing you. I don’t ever stay up praying for someone like I stay up to pray about you. I don’t ever miss anyone but you. I don’t ever cry over being away from anyone but you. You mean so much to me, I don’t know how anyone could live without you.

Despite what you might think, I tell everyone how amazing my mama is, and how wonderfully she raised me. When I moved out, I cried myself to sleep every night because I wanted to be at home with you. I know that may sound conflicting to you because I’m the one that decided to leave, but I couldn’t stay there anymore. I wish that things were a bit more simple. I wish things were a lot more black and white between us. Between everyone in our family. Out of every person, I feel a connection to you that I can’t even begin to explain. I love my mama. I love you so much. I feel in my heart that you’re the most special woman in the world. You’re the most kind, the most funny, the most caring, the most beautiful, the most warm, and the most amazing person ever to exist. Despite how you may think I feel towards you, in my heart of hearts, you have all of me. You truly are the one who taught me how to love and to be loved. You did everything you could for me. You are everything to me. I love you with all of my soul that it hurts to think you aren’t here with me like you used to be. I wish we still had our family together. I think about you all the time. I know you think I talk badly of you, but if there's one thing I can say, it’s that I don’t want anyone thinking wrongly of you. When you do something, I know I can understand it. I know I can see what you were trying to do. Even though I can’t show you that, that’s how I feel in my heart. It’s so hard for me to show you any vulnerability or sympathy. It’s so hard for me to give you the comfort you need when you’re sad. It’s so hard for me to tell you that I know what you’re going through. I know I can feel your struggle, I don’t want anyone to get the wrong impression of you no matter what you’ve done. They don’t know you like I know you, why would I tell them anything that you did? Why would I bad mouth you? You hold so much of my heart Mom. I want our family to love each other. I don’t tell all of the drama to Justin like you think, or vice versa. We rarely speak about family.

How could I tell people who don’t understand you anything negative about you? You’re wonderful. You’re amazing. You’re truly the apple of my eye, mama. You are the best thing to ever happen to me. Why would I want someone else to think you weren’t precious? I don’t tell anyone anything. I don’t go out of my way to ruin things for you. I don’t go off and tell everyone the drama. I don’t think I’m better than you. I could never be the woman that you are or go through the things that you have. You are so strong. You are so thoughtful and willing to help others. You are very selfless. Why would I think I’m better than you? I know you feel like I think that, but it’s just not true. I look up to you in many ways, I know that you’re trying your best to keep everything together and I know that you’re the only one doing that. I would never think I’m better than you. You’re living a hard life. You’re doing very emotionally draining things. How could I think I’m better than you when you do something so rigorous? You’re a strong woman. A beautiful woman. You are a prize to be treasured. There’s no such thing as someone better than you. You have to believe me for a moment when I say that. There's not a part of me that looks down on you, or Dad, or Colbie in the sense that I believe I’m better. I think a lot of times, the two of us get lost in translation. We go off of what we believe the situation is rather than what it truly is. I don’t think I’m more righteous than you. I wish I could do more for you. I wish I could help you and make you happier. I wish I could be someone you could rely on more. I’m sorry I couldn’t give you that comfort. I’m sorry I’ve turned you away so many times. I’m sorry for all the times that I’ve been ungrateful. I’m sorry for being so rude to you and being so mean to you, mama. I’m sorry for not appreciating you more or making you feel like you weren’t good enough. I’m sorry for not giving you a shoulder to cry on or giving you the comfort you needed. I’m sorry that I wasn’t able to hold you when you needed it. I’m sorry for hurting your feelings intentionally and all the many times I did it unintentionally. You deserved a tender heart from me, but I was blind a lot of times to my words or to how you felt. I was blinded by my own pain and anger. I’m sorry for any time I’ve lied to you, any time that I’ve made you feel unhappy, any time that I made you feel like I was looking down on you. I’m sorry for anything I’ve done to come against you or hurt you. I’m so sorry from the bottom of my heart. I’m sorry, mama.

I want you to be happy. I wish I could have been a lot better in the times where I wasn’t good enough. I want nothing but the best for you. I wish that I could take all of your pain away and I wish that I could press a button and have all of our issues wiped away, I wish our family could go back to normal. In this letter, I may say some things that you don’t agree with, but please, for me, please just read what I have to say. Please. I know things in our lives have taken a turn for the worse and it’s like a rollercoaster continuing to push forward in the wrong direction. Our family fell apart so quickly that it was hard to stop it. In reality, when I think about it, it’s all in slow motion. The slow grinding down of every one. I know that our family has struggled with many things, and I know that it’s hard to pinpoint it all. I come to you earnestly mom, I just want you to be honest with me. I just want you to give me some closure and something real. I need that from you Mom. Please. Please allow me this. I know. I know about a lot of things. I know and I don’t know. I know there are things that I’ll never know. You need to be honest with yourself. I know. I’m not trying to judge you, Mom. I’m not trying to hurt you. I just want my mama back so badly. I know you think it’s fine and I know you think things aren’t caused by what you’re doing. But they have been for a long time. This letter isn’t about Dad, but I know he's done more than his fair share of it too. It’s not that I’m just blaming you mama, but you don’t understand what I feel for you. I don’t feel the same things with Dad. I know it feels like I always let him off the hook or am being nicer to him, but it’s because I don’t expect him to do anything else. I expect so much from you because I know what you’re capable of. 

I don’t understand it myself. I don’t know why it’s so much easier to talk to Dad, or why it feels like I can forgive him so easily when I know deep down he’s nothing compared to you. Don’t get me wrong, I love Dad to pieces, but you... You were my mom and my dad for so much of my life. You were always there for me and raised me in the most loving, gentle, and warmest way possible. You did it perfectly, mama. I’m so proud of you. You held me when I cried, you rubbed my feet when they hurt, and you kissed my knees when I fell. You stayed with me. You loved me, you nursed me back to health when I was sick, you made me laugh when I was sad, you played games with me when I was bored. How could anyone be a better mother than you? You’re my person. It’s so much harder for me to forgive you. It’s so much harder for me to speak to you freely. It’s so hard for me because I just want to express to you how much I love you but I can’t help but hold things against you. I can’t help but be mad at you. I’m sorry about that. Something different about him, he’ll be honest with me, even if it’s just a little. He’ll apologize because he knows he’s an addict. An alcoholic. You’re so much more than these drugs, mama. Then those people who are claiming to have your back. Dad is more than the alcohol and addiction too. But you're something special mama. You’re so special. You’re like diamonds and gold, how can anyone be better than you? You’re more than all of this. You’re my world. I can’t help but hold everything against you because I want my mommy so badly. I want the mother who had that soft heart. I want the mother who wasn’t weighed down by the world. I want you. I want you back. I know that these drugs talk for you a lot of the time. I know it feels like you’re in a car with no breaks. I know things are happening so naturally around you that it’s hard to think that these drugs are the issue. I know that mama. I don’t blame you for being addicted. I don’t blame you for hustling. I don’t blame you for living the life that you feel was dealt to you. I don’t blame you for those things, and I don’t hold them against you. I don’t think you’re a bad person. I don’t think you’re disgusting. I don’t think you’re worthless. I don’t think that you’re unsavable. You’re more than any drug in this world, any lifestyle in this world. I don’t blame you for those things. I blame you for not facing those facts though. I blame you for not being honest with yourself and with me. I blame you for not having the dignity to realize that you’re not hiding the truth from anyone. You hurt others more by simply pretending you aren’t doing what you are. If you aren’t ashamed to do it in secret, you shouldn’t be ashamed to do it openly. I know. It’s not hard to tell. I can tell when you’re high. I can tell when you’re sober. I can’t tell every time you lie, but I know you do. Please just be honest with me. Please show me that. Please, mama.

I have suffered a lot in my childhood, but I know many people have. I have gone through a lot of pain in my life, but I know many people have. I know that things and life aren’t always normal. I wish you could be honest with me. If you would give me that, it would be so much easier for me to forgive you and have us move on. We don’t have to live like this forever. Our family doesn’t have to suffer forever. It starts with being honest. You need help. There's nothing wrong with that. I just want things to change and move on from this, I want to grow our lives and be together again. I want to come over to the house and feel welcomed again. I want to see you and feel loved again. I want to hold you and feel like a kid again. I want to show you my heart and not feel scared that you’ll get high again. I want you to leave the drugs behind. I want you to be able to start a new life that you can actually be happy in. I want you back. I want these drugs to die and go to hell.

I know that when I moved out, you had a lot of thoughts about it. I know you thought someone was influencing me. The truth of that is Mom, I’m hardly swayed by others. Every time I confront you or try to talk to you about things that have happened, you always act like its other people who tell me what to say, but that’s simply not true. I have never been moved to say something I don’t believe. I have never been moved to hate you. People don’t talk about you as much as you think they do. When I would come over here to Nana's house before I moved out, none of us would speak on you or whatever situation was going on. We moved out to get away from all of that. I have always driven my own ship. I have always formed my own opinions. Nothing I have ever said to you was brought out by someone else. Justin never talks badly of you, in fact, he only talks about how much he loves you and wishes you would get the help you need. Same for Nana. We defend you more than most people do. It’s not fair for you to blame us in that way. When everything happened after the 4th of July, it wasn’t anyone else’s choice but my own to leave. I had warned you for months that I was going to move out if you and Dad didn’t change, but nothing happened. You didn’t believe me.  I told you in December that things needed to change or I wasn’t staying. The months went on. I tried to bring it up but nothing ever happened when I did. January, nothing. February, nothing. March, nothing. April, nothing. May, nothing. June, nothing. I couldn’t take it anymore. Both you and Dad refused to get the help you needed. The help I begged you to get. I want you to be happy Mom. I want you and Dad to change for the better. I’m sick of this life we seem to be stuck to. The last two years of our lives have felt like... honestly, hell. Alcohol, drugs, anger, violence, manipulation, and more have infested the structure of our family. I wanted change. I needed it. I begged for it. I tried to talk to you about it, I tried to warn you about it, but you would turn me away and get mad. You told me that I wasn’t going to move out. I realized you told me that you wanted the same change as me just so I’d shut up. You guys didn’t even falter when I told you I would leave. You were shocked when I actually did and blamed everyone but yourselves. You and dad. You had six months.

Do you think I wanted to move out mom? Do you think as a 17 year old that I wanted to pay my own bills? To burden the people around me to take me back and forth to work and school? To make all of my choices by myself? Do you think I wanted to be away from my home and my family? I was a child.. I forced myself to grow up and get somewhere that didn’t feel like a house of darkness and depression. I’ve done so much myself and I deserve some credit for that. I don’t deserve you blaming me for leaving. I don’t deserve you treating me like some spoiled brat. I don’t deserve you treating me like I think I’m better than you because I want more for myself. I didn’t deserve how much you guys put on me. I’m your daughter, not your emotional scapegoat. I’m not the one that’s supposed to bring happiness to the house and carry the burden of everyone's depression either. I don’t deserve you belittling me. I handle EVERYTHING on my own. I do EVERYTHING on my own. 

I tried my hardest to keep our relationship after I moved out. I’m the one who came to see y'all, I’m the one who called and texted y'all, I’m the one who forgave y'all. You guys wouldn’t let it go, you guys wouldn’t treat me equally, you guys made me feel like an outsider. That wasn’t fair to me. For the first month after moving out, it felt like I was mourning my family. It felt like I was mourning you. I cried and cried and cried. I laid in bed and sobbed myself to sleep every night because I didn’t have my mom. I want you back mom. I don’t want the drugs. I’ve forgiven you time and time again, the least you could give me is a little respect and honesty. If you want to be honest with me, I’ll always listen. I’ll never judge what you’ve done. If you lie to me again, I’ll continue to push you away. Trust is earned in droplets and lost by buckets. You have lost my trust. I love you. If you want to get in contact with me after you’ve read this entire letter, reach out through someone to let me know. If not, we’ll continue no contact. I love you, mama. I love you so so so so so much. I love you. I miss you. I wish things could heal between us, but I can’t be the only one healing it. I want you in my life. I need my mom. I need my dad. I need my parents while they're still around. I beg you mom. I beg and plead. I need you guys so badly. I just want to be with you guys. I just want yall to love on me and love me. Everyday it feels like I’m mourning the person that I love the most. I want my mom back. I want my dad back. I just want you guys to be happy and healthy. I want you guys to get away from whatever is holding you back. I want only the best for yall. I love you. I pray to God to keep you safe and help you to be happy. Please read this letter earnestly. Bye mom.

",1,7,https://www.reddit.com/r/addiction/comments/1joo7rt/a_letter_to_my_drug_addicted_mother/
1jobzla,2025-03-31 19:37:26,addiction,Sober,"Today is 252 days sober from fent. After 4 long years of addiction i finally got sober. July 21st is my sobriety date and it's crazy to think it will be a year soon. I'm back to working, seeing family/friends, paying my bills on time with some money left over. I'm thankful to be where I am today. 
If anyone thinks they cant get better, you will.
I will admit, i am on methadone and have been the whole time I was using. I'm using the way it was intended now and going down 10mg every 3 weeks. Im at 60mg right now and was at 108 in July. I was scared to cut back, being sick is what kept me on the drug for so long. 
I was only getting from one person and he got locked up for a week, after 1 day i was already puking and tried from someone else. My anxiety is so bad, that one bag had me thinking i was about to die. I never wanted to OD and thankfully never did before. In that moment i decided im not doing any other bags until he comes outta jail. I stuck with my methadone for 2 days and craving a bag. Was cleaning my box so i could find straws to scrape and I find one brand new bag. Felt like i found $1000. I told myself this was it, watever craving i had this would have to fulfill it. I did it, felt good, and never touched another one since. 
Felt like i had the closure i needed too.
",6,5,https://www.reddit.com/r/addiction/comments/1jobzla/sober/
1joenza,2025-03-31 21:26:42,addiction,Xanax Addiction,"I hate this stuff so much. I had been on benzos on and off for 20 years, mainly Klonopin which was much easier to titrate off of.

I was on Klonopin but got switched to Xanax over a year ago back when Klonopin manufactures were all on back orders. So my Dr switched me to Xanax 2mg 3x a day the same dose of Klonopin I was prescribed except I was only actually taking the Klonopin 2mg 2x a day. 

I just want to get off of this stuff so bad. I beat a heroin addiction that I had but this stuff to me is harder to kick than heroin. 

I have a refill on my Xanax next week and appointment next month. I’ve been contemplating scheduling my appointment earlier before my refill to get it switched over to Klonopin again so I can start lowering my dose. In my experience Klonopin was always much easier to taper off of but this Xanax doesn’t last long at all. I take it and read about all the negative stuff and a few hours laster take another 2mg pill to where it’s up to 6-8mg a day now.

I am scared because I don’t have resources for rehab, I have a job, a life and everything is great but this medication is ruining everything. I want to schedule my appointment this week before my upcoming refill to ask my Dr to cancel it to switch it back to Klonopin instead of Xanax because I don’t want to do another month of this and wait til my 3 month follow up with him.

I get weird anxiety that in make it early right before my refill he is gonna cut me off which I know is illogical and just my anxiety because cutting some off of 6mg of Xanax a day is life threatening. I don’t know if I should go in this week show him I’m still taking them and have the remaining pills I should until my refill and so him to cancel it and switch it with Klonopin or just try and cope with it another month and go to my regular 3 month follow up.

My rebound anxiety in the morning is so bad sometimes I have to call off work. I had to call off today or sometimes I’ll set my alarms for 6:45am to take my meds, then have my second one set for 7:30 so when I wake up I don’t feel so awful. 

I don’t know what to do, benzos should not be detoxed in an inpatient setting because it’s a long monthly process 
 ",2,6,https://www.reddit.com/r/addiction/comments/1joenza/xanax_addiction/
